question,answer,area
1009年に成立したベトナム北部初の長期政権で，中国の諸制度を取り入れ，国号を大越とした王朝を何というか。,李朝,東アジア
平安時代の日本において，中国との交流が途絶えたことで発達した，日本独自の貴族文化を何というか。,国風文化,東アジア
916年モンゴル系の遊牧民キタイ（契丹）の耶律阿保機によって建てられた国は中国風に何というか。,遼,東アジア
936年後晋の時代に，支援を受けた代償としてキタイに割譲した地域を何というか。,燕雲十六州,東アジア
1004年，キタイが宋と結んだ講和条約を何というか。,澶淵の盟,東アジア
キタイで行われた，狩猟民・遊牧民と農耕民とを分けて統治する政策を何というか。,二重統治体制,東アジア
1038年，李元昊によって建てられた，チベット系タングートの国を何というか。,西夏,東アジア
1115年，完顔阿骨打によって建てられた，ツングース系女真の国を何というか。,金,東アジア
金の時代，女真人などに適用された部族制に基づく軍事・社会制度を何というか。,猛安・謀克,東アジア
960年地方政権を平定し，開封を都として宋を建国した後周の武将は誰か。,趙匡胤,東アジア
第２代皇帝太宗の治世に確立され，官僚を中心とした政治を目指す政策を何というか。,文治主義,東アジア
宋代に設けられた，皇帝が立ち会う科挙の最終試験を何というか。,殿試,東アジア
宋代以降，儒学の教養をもつ知識人層や新興地主などの人々を何というか。,士大夫,東アジア
唐宋八大家の一人で，神宗により宰相に登用され，改革を断行したのは誰か。,王安石,東アジア
王安石が富国強兵のために断行した諸改革を何というか。,新法,東アジア
司馬光を中心に，新法に反対する保守派勢力を何というか。,旧法党,東アジア
1126～27年北方民族が都を占領し，皇帝の一族などを連れ去り，北宋が滅亡した事件を何というか。,靖康の変,東アジア
靖康の変で逃れた高宗が，臨安を都として江南に建てた王朝を何というか。,南宋,東アジア
ウイグル文字や漢字を基に作られたキタイの文字は何か。,契丹文字,東アジア
キタイの遺臣耶律大石が，中央アジアに建てた国を何というか。,カラキタイ/西遼,東アジア
宋代に台頭した，官僚を多く輩出した新興の地主層を何というか。,形勢戸,東アジア
宋代に地主などの荘園を耕作した小作農家を何というか。,佃戸,東アジア
北宋時代に長江下流域に普及した，日照りに強いベトナム伝来の稲を何というか。,占城稲,東アジア
草市から発展し，商工業の発展により興った地方都市を何というか。,鎮,東アジア
北宋時代以降使用された，世界最初の紙幣を何というか。,交子,東アジア
商工業の発達により，宋代に大量に鋳造された貨幣を何というか。,銅銭/宋銭,東アジア
南宋の儒学者で，朱子学を大成したのは誰か。,朱熹/朱子,東アジア
朱熹による，君臣の道徳や臣下の守るべき本分を説いた論を何というか。,大義名分論,東アジア
宋代に神宗の命で司馬光が編纂した，戦国時代から五代末までを著した通史は何か。,資治通鑑,東アジア
『資治通鑑』に代表される歴史記述方法を何というか。,編年体,東アジア
唐宋八大家の一人で唐末以来の古文復興を継承し，『新唐書』などを著したのは誰か。,欧陽脩,東アジア
唐宋八大家の一人で北宋第一の詩人といわれ，「赤壁の賦」を残したのは誰か。,蘇軾,東アジア
宋代に流行した韻文で，曲にあわせて歌う文芸を何というか。,詞,東アジア
宋代に流行した，歌や台詞を伴う演劇を何というか。,雑劇,東アジア
山水・花鳥・人物などを題材として，宮廷趣味に合うように描かれた，写実的で装飾的な絵画を何というか。,院体画,東アジア
知識人の間に広まった，座禅による実践を特徴とする仏教の宗派を何というか。,禅宗,東アジア
金支配下の華北において，王重陽を開祖とし，儒教・仏教・道教の調和を説く道教の一派を何というか。,全真教,東アジア
火器使用のため，宋代以降改良・実用化されたものは何か。,火薬,東アジア
磁石の指極性を利用し，航海に用いられたものは何か。,羅針盤,東アジア
唐初頃に始まり宋代に普及した印刷技術は何か。,木版印刷,東アジア
宋代において，同業営業の独占や相互扶助のための商人組合を何というか。,行,東アジア
宋代において，相互扶助のための手工業者の組合を何というか。,作,東アジア
北宋の儒学者で，宋学の祖といわれ，『太極図説』を著したのは誰か。,周敦頤,東アジア
南宋の哲学者で，禅宗の影響を受けて「心即理」の唯心論を展開したのは誰か。,陸九淵,東アジア
宮廷において，絵画の制作や保護を司る機関を何というか。,画院,東アジア
宋代に民衆の間で普及した，東晋の慧遠を開祖とし浄土信仰を説く仏教の宗派を何というか。,浄土宗,東アジア
貴族趣味な華麗さを離れる傾向の中，宋代に発達した，青や緑色など単色で簡素な造形の磁器を何というか。,青磁,東アジア
重要事項の決定やカン（ハン）を選定する集会を何というか。,クリルタイ,東アジア
1206年にクリルタイでカンに選出されて大モンゴル国を建て，周辺地域への遠征を行ったのは誰か。,チンギス＝カン/ハン,東アジア
アフガニスタンからイランにかけて支配し，1220年モンゴル軍に攻撃され滅亡したトルコ系イスラーム王朝を何というか。,ホラズム＝シャー朝,東アジア
大モンゴル国の第２代でカアンを称し，1234年に自ら遠征して金を滅ぼしたのは誰か。,オゴデイ/オゴタイ,東アジア
1236～42年南ロシア・東ヨーロッパに西征を行ったのは誰か。,バトゥ,東アジア
西征の途中，1241年モンゴルがドイツ・ポーランド諸侯連合軍を破った戦いを何というか。,ワールシュタットの戦い,東アジア
モンゴルの第４代モンケの命で西アジアに遠征し，1258年アッバース朝を滅ぼしたのは誰か。,フレグ/フラグ,東アジア
モンゴルの第５代で，カアンを称した後，1276（1279）年南宋を征服し中国支配を確立したのは誰か。,クビライ/フビライ,東アジア
クビライが1264年に遷都したのはどこか。,大都,東アジア
クビライが定めた中国風の国号を何というか。,元,東アジア
西アジアや中央アジア出身の諸民族を指し，モンゴルに高級官僚として仕えた人々を何というか。,色目人,東アジア
モンゴルで創設・整備された交通制度を何というか。,駅伝制/ジャムチ,東アジア
金・モンゴルの時代に流通した紙幣を何というか。,交鈔,東アジア
1351年におこった，白蓮教徒などを中心とする大農民反乱を何というか。,紅巾の乱,東アジア
クビライの命により，チベット文字をもとに作成された文字を何というか。,パクパ文字,東アジア
チベットで成立しモンゴルで保護された仏教を何というか。,チベット仏教,東アジア
1280年郭守敬が作成し，日本の貞享暦などにも影響を与えた陰陽暦を何というか。,授時暦,東アジア
『西廂記』や『琵琶記』など口語の歌詞や台詞を伴う演劇を何というか。,元曲,東アジア
1370年成立してサマルカンドを都とし，その後イル＝ハン国滅亡後の西アジアに勢力を拡大した王朝を何というか。,ティムール朝,東アジア
ティムール朝が，1402年オスマン帝国軍を撃破しスルタンのバヤジット１世を捕虜とした戦いを何というか。,アンカラの戦い,東アジア
モンゴルの偵察と布教のため教皇により派遣され，カラコルムに到着しハンと会見したのは誰か。,プラノ＝カルピニ,東アジア
十字軍への支援要請のためフランス王ルイ９世により派遣され，カラコルムに到着してモンケ＝ハンと会見したのは誰か。,ルブルック,東アジア
ヴェネツィア出身で，1275年大都に到着してクビライに仕え，帰国後『世界の記述（東方見聞録）』を口述したのは誰か。,マルコ＝ポーロ,東アジア
教皇の使節として1294年大都に到着し，中国で最初にカトリックの布教活動を行ったのは誰か。,モンテ＝コルヴィノ,東アジア
モロッコ出身の旅行家で世界各地を旅し，『旅行記』（『三大陸周遊記』）を口述したのは誰か。,イブン＝バットゥータ,東アジア
1351～66年，白蓮教徒を中心とした元末の農民反乱を何というか。,紅巾の乱,東アジア
明朝初代皇帝で，紅巾の乱の混乱の中から台頭し，1368年に即位したのは誰か。,朱元璋/太祖，洪武帝,東アジア
明の最初の都となったのはどこか。,南京/金陵,東アジア
大都を明に奪われ，モンゴル高原に退いた後の元は，後に何と呼ばれるか。,北元,東アジア
北元はある機関を廃止して，その直轄下にあった六部を皇帝直属のものとしたが，ある機関とは何か。,中書省,東アジア
北元の設置した兵制で，唐の府兵制を模し，兵農一致を図った制度を何というか。,衛所制,東アジア
農村の110戸を一里として，里長戸や甲首戸に徴税や治安維持の義務を負わせた制度を何というか。,里甲制,東アジア
民衆教化のために制定した，六カ条からなる教訓を何というか。,六諭,東アジア
建文帝の諸王抑圧策に対し，1399～1402年に燕王（のちの永楽帝）が起こした反乱を何というか。,靖難の役,東アジア
1421年，永楽帝が遷都した明の首都はどこか。,北京/北平,東アジア
現在の沖縄県に位置し，中国との朝貢貿易や中継貿易で栄えた国を何というか。,琉球,東アジア
14世紀末東南アジアのイスラーム化が進む中で成立し，インド洋と南シナ海を結ぶ中継貿易で栄えたマレー半島南部の国はどこか。,マラッカ,東南アジア
朝鮮半島において，1392年，高麗を倒し朝鮮（李朝）を建国した武将は誰か。,李成桂,東アジア
朝鮮（李朝）の首都はどこか。,漢城/漢陽，ソウル,東アジア
朝鮮（李朝）第４代の王世宗が制定した朝鮮特有の文字を何というか。,訓民正音/ハングル,東アジア
朝鮮（李朝）において世界で初めて実用化された印刷技術で，書物の印刷に用いられたものは何か。,金属活字/銅活字,東アジア
1338年，足利尊氏によって日本に成立した政権を何というか。,室町幕府,東アジア
足利義満が1404年，明との間に始めた割符貿易を何というか。,勘合貿易,東アジア
15世紀前半，陳朝の武将黎利が建国し，明の制度を取り入れ朱子学を振興したベトナムの王朝を何というか。,黎朝,東アジア
モンゴル高原一帯を支配したオイラトのエセンが，1449年北京郊外の土木堡で明の皇帝を捕虜とした事件を何というか。,土木の変,東アジア
明代の戸籍簿・租税台帳を何というか。,賦役黄冊,東アジア
明代に整備された土地台帳を何というか。,魚鱗図冊,東アジア
兵を出す義務を負った家のことを何というか。,軍戸,東アジア
明朝第２代の皇帝で，諸王に対する抑圧策をとったため反乱を招いたのは誰か。,建文帝,東アジア
永楽帝以降に修築された北辺防衛のための大建造物は何か。,万里の長城,東アジア
北方のモンゴル諸集団を統一し，1550年には北京を包囲するなどしばしば長城を越えて侵入したモンゴルの族長は誰か。,アルタン＝ハーン,東アジア
15世紀後半～16世紀，ダヤン＝ハーンやその孫アルタン＝ハーンによって統一された中国北方の部族を何というか。,モンゴル/韃靼,東アジア
北からモンゴル系の諸部族が侵入し，南では倭寇の活動が激しくなって明を苦しめたことを何というか。,北虜南倭,東アジア
メキシコ銀や日本銀の流入を背景に，明代後半に新たに実施された税制を何というか。,一条鞭法,東アジア
万暦帝の治世，内閣大学士として財政改革を行った政治家は誰か。,張居正,東アジア
塩の専売によって利益を得た徽州（新安）商人に対し，金融業や運輸業で利益を得た特権商人を何というか。,山西商人,東アジア
商工業の同業者や同郷者が，親睦や援助のために建てた建物を何というか。,会館・公所,東アジア
明代の地方社会では，官僚を引退した大土地所有者が有力者として影響力を持ったが，この人々を何というか。,郷紳,東アジア
江西省にある中国を代表する陶磁器生産地を答えよ。,景徳鎮,東アジア
知行合一を説いて実践を重視し，陽明学を確立した明の学者・政治家は誰か。,王陽明/王守仁,東アジア
李時珍が完成した医薬書で，1898種の薬物を分類しているものは何か。,本草綱目,東アジア
14世紀，スコータイ朝末期に建国されたタイ人の王国で，ヨーロッパのほか日本や中国などとさかんに通商して栄えた国を答えよ。,アユタヤ朝,東南アジア
豊臣秀吉が行った朝鮮侵略を，朝鮮では何というか。,壬辰・丁酉倭乱,東アジア
上記12の際，亀船を用いて日本軍に抵抗したとされる朝鮮の武将は誰か。,李舜臣,東アジア
江戸時代初期，幕府が与えた渡航許可証を携え，主に東南アジア方面と貿易を行った船を何というか。,朱印船,東アジア
17世紀前半，江戸幕府が行った対外関係統制策を何と表わすか。,鎖国,東アジア
かつて金を建国し，中国東北地方で農牧・狩猟の生活を営んでいたツングース系の民族を何というか。,女真,東アジア
女真を統一し，1616年，国号を金（後金，満洲語でアイシン）として中国東北地方に建国したのは誰か。,ヌルハチ,東アジア
ヌルハチが創設した兵制で，色の違う旗を標識に８つの軍団を組織したものを何というか。,八旗,東アジア
金の第２代皇帝で，1636年に国号を清と改めたのは誰か。,太宗/ホンタイジ,東南アジア
1644年，北京を陥落させ明を滅ぼした農民反乱の指導者は誰か。,李自成,東アジア
東林書院に集まり，当時の政府を激しく批判した明末の官僚らを何というか。,東林派,東アジア
北宋末期を舞台にした108人の豪傑の武勇物語を小説化したもので，明代に完成した長編小説は何か。,水滸伝,東アジア
15世紀末，スマトラ島北端に成立したイスラーム教国を答えよ。,アチェ王国,東南アジア
1531年，ビルマ人がタウングー（トゥングー）に建国し，パガン朝以来のビルマの再統一を果たした王朝を何というか。,タウングー/トゥングー朝,東南アジア
16世紀末，マジャパヒト王国滅亡後のジャワ島に建国されたイスラーム教国を答えよ。,マタラム王国,東南アジア
17世紀はじめ，東南アジアに進出した日本人がつくった居住地を何というか。,日本町,東アジア
マルク（モルッカ）諸島などで多く産出され，防腐剤や調味料としてヨーロッパで需要が高まったアジアの特産品は何か。,香辛料,ヨーロッパ
「航海王子」とよばれ，アフリカ西海岸の探検を推進したポルトガルの王子は誰か。,エンリケ,ヨーロッパ
ジョアン２世の治世，1488年アフリカ南端の喜望峰に達したポルトガルの航海者は誰か。,バルトロメウ＝ディアス,ヨーロッパ
喜望峰を迂回したのち，アフリカ東岸からインド洋を横断し，1498年インドに到達したポルトガルの航海者は誰か。,ヴァスコ＝ダ＝ガマ,ヨーロッパ
ヴァスコ＝ダ＝ガマが到達したインド西岸の都市を答えよ。,カリカット,ヨーロッパ
インド航路の開拓で莫大な利益を得たポルトガルの首都を答えよ。,リスボン,ヨーロッパ
スペイン女王イサベルの支援を受け，1492年，カリブ海のサンサルバドル島に到達したジェノヴァ生まれの船乗りは誰か。,コロンブス,ヨーロッパ
コロンブスに影響を与えたフィレンツェの天文学者で，地球球体説を唱えたのは誰か。,トスカネリ,ヨーロッパ
当時西ヨーロッパの人々は，東南アジア・インドを含むアジア一帯を何と呼んでいたか。,インド/インディアス,ヨーロッパ
インド航路を進む途中，嵐にあい，現在のブラジルに漂着したポルトガル人は誰か。,カブラル,ヨーロッパ
コロンブスの到達した土地が，インドではなく「新世界」であることを確認したイタリアの航海者は誰か。,アメリゴ＝ヴェスプッチ,ヨーロッパ
アメリゴ＝ヴェスプッチの名前にちなんで新大陸につけられた名称を何というか。,アメリカ,ヨーロッパ
航海中フィリピンで命を落としたものの，1522年その部下が世界周航を成し遂げた人物は誰か。,マゼラン,ヨーロッパ
マゼランが，南アメリカ大陸の迂回に成功したのち命名した「平和な海」とは何を指すか。,太平洋,ヨーロッパ
アステカ王国を滅ぼし，メキシコを征服したスペイン人は誰か。,コルテス,南北アメリカ
1533年インカ帝国を滅ぼし，首都クスコを侵略したのち，新首都リマを建設したスペイン人は誰か。,ピサロ,南北アメリカ
1545年に発見された新大陸最大の銀山を何というか。,ポトシ銀山,南北アメリカ
植民者に対してスペイン王室が許可した，キリスト教布教の義務と引き換えに先住民に貢納や労働を課す制度を何というか。,エンコミエンダ制,南北アメリカ
ヨーロッパの商業が世界的広がりを持つようになり，貿易の中心が地中海から大西洋を臨む地域に移動したことを何というか。,商業革命,南北アメリカ
征服者に酷使されるインディオの状況を報告し，その救済に努めたスペインの聖職者は誰か。,ラス＝カサス,南北アメリカ
ポルトガルのアジア進出の拠点となったインド西岸の都市はどこか。,ゴア,ヨーロッパ
ポルトガルの対中国貿易の拠点となった広州南方の港はどこか。,マカオ,ヨーロッパ
1543年，ポルトガル人が漂着し，鉄砲を伝えたとされる日本の九州南方の島を何というか。,種子島,日本
イギリス王室の支援を受け，北アメリカ大陸を探検したのは誰か。,カボット/父子,ヨーロッパ
中南米へ移動した後，パナマ地峡を横断して太平洋に到着したスペインの航海者は誰か。,バルボア,ヨーロッパ
1370年，サマルカンドを都としてティムール朝を建国した西チャガタイ＝ハン国の武将は誰か。,ティムール,西アジア・北アフリカ
1402年ティムール朝とオスマン帝国が衝突し，オスマン帝国が大敗した戦いを何というか。,アンカラの戦い,西アジア・北アフリカ
1453年，オスマン帝国のメフメト２世によって滅ぼされたヨーロッパの帝国はどこか。,ビザンツ帝国,西アジア・北アフリカ
ビザンツ帝国の滅亡とともに，新たにオスマン帝国の首都となった都市はどこか。,イスタンブル/コンスタンティノープル,西アジア・北アフリカ
1517年，マムルーク朝を滅ぼしたオスマン帝国のスルタンは誰か。,セリム１世,西アジア・北アフリカ
マムルーク朝を滅ぼすことによって，オスマン帝国が保護権を獲得した聖地を２つ答えよ。,メッカ，メディナ,西アジア・北アフリカ
オスマン帝国の最盛期を現出した第10代スルタンは誰か。,スレイマン１世,西アジア・北アフリカ
1538年，スレイマン１世がスペイン・ヴェネツィアの連合艦隊を破り，地中海を掌握した戦いを何というか。,プレヴェザの海戦,西アジア・北アフリカ
オスマン帝国の拡大が終息して領土が安定した結果，従来のティマール制から移行していった税制を何というか。,徴税請負制,西アジア・北アフリカ
オスマン帝国が，神聖ローマ帝国に対抗する目的で，フランスなどのヨーロッパ諸国に与えた特権を何というか。,カピチュレーション,西アジア・北アフリカ
スレイマン１世が首都に建立させたトルコ＝イスラーム建築のモスクは何か。,スレイマン＝モスク,西アジア・北アフリカ
1571年，オスマン帝国が，スペイン・ヴェネツィア・ローマ教皇の連合艦隊に敗れた戦いを何というか。,レパントの海戦,西アジア・北アフリカ
オスマン帝国のスルタン直属の常備歩兵軍団で，キリスト教徒の子弟をイスラーム教に改宗させて訓練したものを何というか。,イェニチェリ,西アジア・北アフリカ
サファヴィー朝初代の君主は誰か。,イスマーイール１世,西アジア・北アフリカ
イランのサファヴィー朝が国教としたイスラーム教の宗派は何か。,シーア派,西アジア・北アフリカ
サファヴィー朝第５代の王（シャー）で，イスファハーンに遷都し，最盛期を築いたのは誰か。,アッバース１世,西アジア・北アフリカ
1526年パーニーパットの戦いでロディー朝に勝利し，ムガル帝国を創始したのは誰か。,バーブル,南アジア
ムガル帝国の第３代皇帝で，都をアグラに定めるとともに，人頭税（ジズヤ）を廃止してヒンドゥー教徒との和解を図ったのは誰か。,アクバル,南アジア
王妃のためにタージ＝マハルを建設したムガル帝国第５代皇帝は誰か。,シャー＝ジャハーン,南アジア
ムガル帝国第６代皇帝で，非ムスリムに対する迫害や，ジズヤの復活などで専制をしいたのは誰か。,アウラングゼーブ,南アジア
オスマン帝国で騎士に軍事奉仕の代償として与えられた土地（およびその土地における徴税権）を何というか。,ティマール,西アジア・北アフリカ
オスマン帝国内につくられた非ムスリムの共同体を何というか。,ミッレト,西アジア・北アフリカ
ムガル帝国からの独立をめざして建国された西インドのヒンドゥー教国を何というか。,マラーター王国,西アジア・北アフリカ
ナーナクが開祖となり，ヒンドゥー教を基礎にイスラーム教が融合して成立した宗教は何か。,シク教,西アジア・北アフリカ
ペルシア語とインドの地方語が融合して生まれたインド＝ヨーロッパ系の言語で，現在パキスタンの国語となっているのは何か。,ウルドゥー語,南アジア
イランのミニアチュールから発展したムガル帝国時代の宮廷絵画を何というか。,ムガル絵画,南アジア
16世紀に西北インドで発展し，上記⑥に比べて庶民的な題材を扱った絵画を何というか。,ラージプート絵画,南アジア
1644年に明が滅亡したのを機に清軍に降り，清の中国統一に力を貸した明の武将は誰か。,呉三桂,東アジア
明の滅亡後，明の復活を求めて清と戦った明の遺臣で，国姓爺として知られるのは誰か。,鄭成功,東アジア
鄭成功およびその一族が，オランダ人を排除して1683年まで占領し，反清運動の拠点としていた東シナ海の島はどこか。,台湾,東アジア
呉三桂らが，1673～81年に清朝に反発しておこした反乱を何というか。,三藩の乱,東アジア
